{
  "schema_version": "logos.doctrine_mesh_audit_receipt.v2",
  "receipt_id": "DMR-PREFLIGHT-001",
  "event_id": "DMA-PREFLIGHT-001",
  "event_digest": "sha256:6d26ce3ab8019fd785cb9ef2389fbb85745fb742e36bfb5a3c08ad7bbb67121d",
  "sequence": 1,
  "phase": "preflight",
  "execution_class": "manual_specification_coverage_review",
  "work_unit_id": "WORK-GOV-LOGOS-STEWARDSHIP-BUILDOUT-001",
  "work_unit_revision": "doctrine-mesh-v2-draft-1",
  "input_manifest_ref": "evidence/inputs/preflight.json",
  "input_manifest_digest": "sha256:04a5366517a5f5605dae21c7ba6efe8d4c2591316ed1a7f1c178c8c057f56260",
  "auditor_role_id": "doctrine-mesh-completeness-auditor",
  "auditor_attempt_id": "DMA-ATTEMPT-PREFLIGHT-001",
  "execution_attempt_ref": "evidence/execution-attempts.json#DMA-ATTEMPT-PREFLIGHT-001",
  "controller_runtime_receipt_ref": null,
  "controller_runtime_receipt_digest": null,
  "checker_role_id": "independent-whole-work-checker",
  "coverage_plan_ref": "evidence/coverage/preflight.yaml",
  "coverage_plan_digest": "sha256:3e019d564a8f603320fc4906f7556a9f47fa0e4ef50d0f2caccaa4a6e73ff0f1",
  "role_gap_registry_ref": "evidence/gaps/preflight.yaml",
  "role_gap_registry_digest": "sha256:604957e66399f740c252830701a2be9a4358c823e4359e02759b8dbe8cfa0ea5",
  "status": "pass",
  "execution_presence": "deterministically_proven_for_exact_event_and_inputs",
  "substantive_completeness": "not_deterministically_provable_requires_independent_review",
  "started_at": "2026-08-24T15:28:10Z",
  "auditor_completed_at": "2026-08-24T15:30:00Z",
  "checker_started_at": "2026-08-24T16:47:00Z",
  "checker_completed_at": "2026-08-24T16:47:30Z",
  "completed_at": "2026-08-24T16:47:31Z",
  "previous_receipt_digest": null,
  "receipt_digest": "sha256:91beb18082435358a2fee2512da81f584dcda5ec445ae1083bc7266867bd4ded"
}
