{
  "schema_version": "logos.doctrine_mesh_audit_receipt.v2",
  "receipt_id": "DMR-POSTFLIGHT-001",
  "event_id": "DMA-POSTFLIGHT-001",
  "event_digest": "sha256:462fcad3f85e2318ffba545c01e579030a1ec66535afa3083a19a230be34bd46",
  "sequence": 3,
  "phase": "postflight",
  "execution_class": "manual_specification_coverage_review",
  "work_unit_id": "WORK-GOV-LOGOS-STEWARDSHIP-BUILDOUT-001",
  "work_unit_revision": "doctrine-mesh-v2-design-postflight-1",
  "input_manifest_ref": "evidence/inputs/postflight.json",
  "input_manifest_digest": "sha256:12bd20913d1c5d6ffbb468d56f3c201ad7356b68c91af590ba8cfd6c8980ee8e",
  "auditor_role_id": "doctrine-mesh-completeness-auditor",
  "auditor_attempt_id": "DMA-ATTEMPT-POSTFLIGHT-001",
  "execution_attempt_ref": "evidence/execution-attempts.json#DMA-ATTEMPT-POSTFLIGHT-001",
  "controller_runtime_receipt_ref": null,
  "controller_runtime_receipt_digest": null,
  "checker_role_id": "independent-whole-work-checker",
  "coverage_plan_ref": "evidence/coverage/postflight.yaml",
  "coverage_plan_digest": "sha256:b6e89fbb1f67c9237dbcc07c70def8f30b712afb49d3e317de115cfcd2238af4",
  "role_gap_registry_ref": "evidence/gaps/postflight.yaml",
  "role_gap_registry_digest": "sha256:f430ac8d8017a963a9dd1162042a63ae140b0b6bd74fd7a04fc467093f650e55",
  "status": "pass",
  "execution_presence": "deterministically_proven_for_exact_event_and_inputs",
  "substantive_completeness": "not_deterministically_provable_requires_independent_review",
  "started_at": "2026-08-24T16:50:21Z",
  "auditor_completed_at": "2026-08-24T16:50:35Z",
  "checker_started_at": "2026-08-24T16:50:36Z",
  "checker_completed_at": "2026-08-24T16:50:55Z",
  "completed_at": "2026-08-24T16:50:56Z",
  "previous_receipt_digest": "sha256:ae85118b4fdd10340fe8db26592feb004965141b80ae5044fc9cd06abd2ac65a",
  "receipt_digest": "sha256:d148b292e056b4039b5ad21c6f80f8191ca03cc5362bcb49b84589eac6f6674d"
}
