{
  "schema_version": "logos.doctrine_mesh_audit_receipt.v2",
  "receipt_id": "DMR-MIDFLIGHT-001",
  "event_id": "DMA-MIDFLIGHT-001",
  "event_digest": "sha256:7851a8f96d29a45881434a32ab80a5af1ecad795a4239d4258c0ad82387ccc04",
  "sequence": 2,
  "phase": "midflight",
  "execution_class": "manual_specification_coverage_review",
  "work_unit_id": "WORK-GOV-LOGOS-STEWARDSHIP-BUILDOUT-001",
  "work_unit_revision": "doctrine-mesh-v2-draft-2",
  "input_manifest_ref": "evidence/inputs/midflight.json",
  "input_manifest_digest": "sha256:ead6a2f11aa811defb483229d49904b780338bd762f1c673ba42ec11f41c0d5a",
  "auditor_role_id": "doctrine-mesh-completeness-auditor",
  "auditor_attempt_id": "DMA-ATTEMPT-MIDFLIGHT-001",
  "execution_attempt_ref": "evidence/execution-attempts.json#DMA-ATTEMPT-MIDFLIGHT-001",
  "controller_runtime_receipt_ref": null,
  "controller_runtime_receipt_digest": null,
  "checker_role_id": "independent-whole-work-checker",
  "coverage_plan_ref": "evidence/coverage/midflight.yaml",
  "coverage_plan_digest": "sha256:1809381c1e07eb22bef1d08f10aa0d7ac70bcccd69f33f76c583f2818d775d47",
  "role_gap_registry_ref": "evidence/gaps/midflight.yaml",
  "role_gap_registry_digest": "sha256:92c65840cdc25b9fc0be804264a6724af4915b119ddb71be2092d94c9845543c",
  "status": "pass",
  "execution_presence": "deterministically_proven_for_exact_event_and_inputs",
  "substantive_completeness": "not_deterministically_provable_requires_independent_review",
  "started_at": "2026-08-24T15:42:10Z",
  "auditor_completed_at": "2026-08-24T15:46:30Z",
  "checker_started_at": "2026-08-24T16:47:32Z",
  "checker_completed_at": "2026-08-24T16:48:00Z",
  "completed_at": "2026-08-24T16:48:01Z",
  "previous_receipt_digest": "sha256:91beb18082435358a2fee2512da81f584dcda5ec445ae1083bc7266867bd4ded",
  "receipt_digest": "sha256:ae85118b4fdd10340fe8db26592feb004965141b80ae5044fc9cd06abd2ac65a"
}
